Sheet: Лист1
A1: 1 | B1: =RC[-1]*2 -> 2
A2: 2 | B2: =RC[-1]*2 -> 4
A3: 3 | B3: =RC[-1]*2 -> 6
A4: 4 | B4: =RC[-1]*2 -> 8
A5: 5 | B5: =RC[-1]*2 -> 10
A6: 6 | B6: =RC[-1]*2 -> 12
A7: 7 | B7: =RC[-1]*2 -> 14
A8: 8 | B8: =RC[-1]*2 -> 16
A9: 9 | B9: =RC[-1]*2 -> 18
A10: 10 | B10: =RC[-1]*2 -> 20
A11: 11 | B11: =RC[-1]*2 -> 22
A12: 12 | B12: =RC[-1]*2 -> 24
A13: 13 | B13: =RC[-1]*2 -> 26
A14: 14 | B14: =RC[-1]*2 -> 28
A15: 15 | B15: =RC[-1]*2 -> 30
A16: 16 | B16: =RC[-1]*2 -> 32
A17: 17 | B17: =RC[-1]*2 -> 34
A18: 18 | B18: =RC[-1]*2 -> 36
A19: 19 | B19: =RC[-1]*2 -> 38
A20: 20 | B20: =RC[-1]*2 -> 40
A21: 21 | B21: =RC[-1]*2 -> 42
A22: 22 | B22: =RC[-1]*2 -> 44