Sheet: Лист1
A1: 0 | B1: =SQRT(RC[-1]) -> 0
A2: 0.1 | B2: =SQRT(RC[-1]) -> 0.31622776601683794
A3: 0.2 | B3: =SQRT(RC[-1]) -> 0.44721359549995793
A4: 0.3 | B4: =SQRT(RC[-1]) -> 0.54772255750516607
A5: 0.4 | B5: =SQRT(RC[-1]) -> 0.63245553203367588
A6: 0.5 | B6: =SQRT(RC[-1]) -> 0.70710678118654757
A7: 0.6 | B7: =SQRT(RC[-1]) -> 0.7745966692414834
A8: 0.7 | B8: =SQRT(RC[-1]) -> 0.83666002653407556
A9: 0.8 | B9: =SQRT(RC[-1]) -> 0.89442719099991586
A10: 0.9 | B10: =SQRT(RC[-1]) -> 0.94868329805051377
A11: 1 | B11: =SQRT(RC[-1]) -> 1
A12: 2 | B12: =SQRT(RC[-1]) -> 1.4142135623730951
A13: 3 | B13: =SQRT(RC[-1]) -> 1.7320508075688772
A14: 4 | B14: =SQRT(RC[-1]) -> 2
A15: 5 | B15: =SQRT(RC[-1]) -> 2.2360679774997898
A16: 6 | B16: =SQRT(RC[-1]) -> 2.4494897427831779
A17: 7 | B17: =SQRT(RC[-1]) -> 2.6457513110645907
A18: 8 | B18: =SQRT(RC[-1]) -> 2.8284271247461903
A19: 9 | B19: =SQRT(RC[-1]) -> 3
A20: 10 | B20: =SQRT(RC[-1]) -> 3.1622776601683795
A21: 11 | B21: =SQRT(RC[-1]) -> 3.3166247903553998
A22: 12 | B22: =SQRT(RC[-1]) -> 3.4641016151377544
A23: 13 | B23: =SQRT(RC[-1]) -> 3.6055512754639891
A24: 14 | B24: =SQRT(RC[-1]) -> 3.7416573867739413
A25: 15 | B25: =SQRT(RC[-1]) -> 3.872983346207417
A26: 16 | B26: =SQRT(RC[-1]) -> 4
A27: 17 | B27: =SQRT(RC[-1]) -> 4.1231056256176606
A28: 18 | B28: =SQRT(RC[-1]) -> 4.2426406871192848
A29: 19 | B29: =SQRT(RC[-1]) -> 4.358898943540674
A30: 20 | B30: =SQRT(RC[-1]) -> 4.4721359549995796
A31: 21 | B31: =SQRT(RC[-1]) -> 4.5825756949558398
A32: 22 | B32: =SQRT(RC[-1]) -> 4.6904157598234297
A33: 23 | B33: =SQRT(RC[-1]) -> 4.7958315233127191
A34: 24 | B34: =SQRT(RC[-1]) -> 4.8989794855663558
A35: 25 | B35: =SQRT(RC[-1]) -> 5
A36: 26 | B36: =SQRT(RC[-1]) -> 5.0990195135927845
A37: 27 | B37: =SQRT(RC[-1]) -> 5.196152422706632
A38: 28 | B38: =SQRT(RC[-1]) -> 5.2915026221291814
A39: 29 | B39: =SQRT(RC[-1]) -> 5.3851648071345037
A40: 30 | B40: =SQRT(RC[-1]) -> 5.4772255750516612
A41: 31 | B41: =SQRT(RC[-1]) -> 5.5677643628300215
A42: 32 | B42: =SQRT(RC[-1]) -> 5.6568542494923806
A43: 33 | B43: =SQRT(RC[-1]) -> 5.7445626465380286
A44: 34 | B44: =SQRT(RC[-1]) -> 5.8309518948453007
A45: 35 | B45: =SQRT(RC[-1]) -> 5.9160797830996161
A46: 36 | B46: =SQRT(RC[-1]) -> 6
A47: 37 | B47: =SQRT(RC[-1]) -> 6.0827625302982193
A48: 38 | B48: =SQRT(RC[-1]) -> 6.164414002968976
A49: 39 | B49: =SQRT(RC[-1]) -> 6.2449979983983983
A50: 40 | B50: =SQRT(RC[-1]) -> 6.324555320336759
A51: 41 | B51: =SQRT(RC[-1]) -> 6.4031242374328485
A52: 42 | B52: =SQRT(RC[-1]) -> 6.4807406984078604
A53: 43 | B53: =SQRT(RC[-1]) -> 6.5574385243020004
A54: 44 | B54: =SQRT(RC[-1]) -> 6.6332495807107996
A55: 45 | B55: =SQRT(RC[-1]) -> 6.7082039324993694
A56: 80 | B56: =SQRT(RC[-1]) -> 8.9442719099991592
A57: 120 | B57: =SQRT(RC[-1]) -> 10.954451150103322
A58: 200 | B58: =SQRT(RC[-1]) -> 14.142135623730951
A59: 500 | B59: =SQRT(RC[-1]) -> 22.360679774997898
A60: 785 | B60: =SQRT(RC[-1]) -> 28.0178514522438
A61: 1000 | B61: =SQRT(RC[-1]) -> 31.622776601683793